<!ELEMENT comandas (comanda*)>
<!ELEMENT comanda (numeroSerie, cantidad, peso?)>
<!ELEMENT numeroSerie (#PCDATA)>
<!ELEMENT cantidad (#PCDATA)>
<!ELEMENT peso (#PCDATA)>
